{
  "checks": [
    {
      "description": "All 60 attributes per CityObject survive encode/decode without loss. Null values and mixed scalar types across objects are preserved.",
      "id": "attributes_preserved"
    },
    {
      "description": "The case exposes the intended attribute allocation shape (60k key-value pairs across 1000 objects).",
      "id": "bottleneck_shape_visible"
    }
  ],
  "id": "stress_attribute_heavy_heterogenous",
  "kind": "positive",
  "version": 1
}
