{
  "checks": [
    {
      "description": "Materials and textures on each Solid geometry are preserved after encode/decode.",
      "id": "appearance_preserved"
    },
    {
      "description": "Semantic surface assignments on each Solid geometry are preserved after encode/decode.",
      "id": "semantics_preserved"
    },
    {
      "description": "The case exposes the intended combined-annotation shape (semantics + materials + textures on 1000 Solid geometries).",
      "id": "bottleneck_shape_visible"
    }
  ],
  "id": "stress_resource_heavy",
  "kind": "positive",
  "version": 1
}
