{
  "checks": [
    {
      "description": "Vertex indexing stays stable across parse and roundtrip.",
      "id": "vertex_indices_preserved"
    },
    {
      "description": "Roundtrip coordinate drift stays below 1e-4 meters (sub-100-micrometer) for worst realistic case: national grid at 0.1 mm precision and maximum extent.",
      "id": "coordinates_precision_roundtrip"
    },
    {
      "description": "Transformation properties stay stable across parse and roundtrip.",
      "id": "transform_preserved"
    }
  ],
  "id": "coordinates_precision_worst",
  "kind": "positive",
  "version": 1
}
