{
  "checks": [
    {
      "description": "Composite attribute values survive roundtrip.",
      "id": "composite_values_preserved"
    },
    {
      "description": "The case exposes mixed-cost paths during processing.",
      "id": "mixed_cost_paths_visible"
    }
  ],
  "id": "stress_composite_value",
  "kind": "positive",
  "version": 1
}
