{
  "checks": [
    {
      "description": "Appearance data survives roundtrip.",
      "id": "appearance_preserved"
    },
    {
      "description": "Default material and texture are set.",
      "id": "default_material_texture_set"
    },
    {
      "description": "Multiple material and texture are set.",
      "id": "multiple_material_texture_set"
    },
    {
      "description": "Uniform material assignments use the canonical 'value' form.",
      "id": "material_assignment"
    }
  ],
  "id": "appearance_complete",
  "kind": "positive",
  "version": 1
}
